{
  "eventId": "10000000-0000-4000-8000-000000000001",
  "eventType": "PlanActivated",
  "occurredAt": "2026-10-05T12:00:00Z",
  "producer": "PlanningSystem",
  "schemaVersion": "1.0.0",
  "correlationId": "10000000-0000-4000-8000-000000000001",
  "projectId": "10000000-0000-4000-8000-000000000001",
  "payload": {
    "planVersionId": "10000000-0000-4000-8000-000000000001",
    "previousPlanVersionId": null,
    "versionNumber": 1,
    "contentRevision": 1
  }
}
